{
  "$schema": "../../schema/lesson.schema.json",
  "id": "01a",
  "number": 1,
  "title": "Questions and answers",
  "source": "English File Upper-Intermediate Plus (4.ª ed.), 1A, pp. 6–9 y Grammar Bank p. 132",
  "classDate": "2026-10-05",
  "objectives": [
    "Formar preguntas con auxiliares y modales (inversión, do/does/did).",
    "Usar preguntas negativas para mostrar sorpresa o confirmar algo.",
    "Colocar la preposición al final de la pregunta.",
    "Distinguir las preguntas de sujeto, que no llevan do/did.",
    "Hacer preguntas indirectas para sonar más educado.",
    "Reaccionar con interés a una respuesta y negarse con educación a contestar."
  ],
  "vocabulary": [
    { "id": "v-job-seeker", "word": "job-seeker", "translation": "persona que busca empleo", "partOfSpeech": "noun", "example": "The website gives advice to **job-seekers**.", "exampleTranslation": "La web da consejos a quienes buscan empleo." },
    { "id": "v-point-of", "word": "the point of", "translation": "el sentido de, la finalidad de", "partOfSpeech": "phrase", "example": "What's **the point of** a CV if nobody reads it?", "exampleTranslation": "¿Qué sentido tiene un currículum si nadie lo lee?" },
    { "id": "v-rivalry", "word": "good-natured rivalry", "translation": "rivalidad amistosa", "partOfSpeech": "phrase", "example": "There's a **good-natured rivalry** between the two teams.", "exampleTranslation": "Hay una rivalidad amistosa entre los dos equipos.", "pronunciationHint": "/ˈraɪvlri/ · «RÁI-vl-ri»" },
    { "id": "v-light-hearted", "word": "light-hearted response", "translation": "respuesta desenfadada", "partOfSpeech": "phrase", "example": "She gave a **light-hearted response** and everybody laughed.", "exampleTranslation": "Dio una respuesta desenfadada y todos se rieron.", "pronunciationHint": "/ˌlaɪt ˈhɑːtɪd/" },
    { "id": "v-foolproof", "word": "foolproof", "translation": "infalible, a prueba de fallos", "partOfSpeech": "adjective", "example": "There's no **foolproof** way to pass an interview.", "exampleTranslation": "No hay una forma infalible de superar una entrevista." },
    { "id": "v-geek", "word": "geek", "translation": "friki, obseso de un tema (informal)", "partOfSpeech": "noun", "example": "My brother is a real computer **geek**.", "exampleTranslation": "Mi hermano es un auténtico friki de los ordenadores.", "pronunciationHint": "/ɡiːk/ · i larga" },
    { "id": "v-work-life", "word": "work–life balance", "translation": "equilibrio entre trabajo y vida personal", "partOfSpeech": "phrase", "example": "I changed jobs to get a better **work–life balance**.", "exampleTranslation": "Cambié de trabajo para tener un mejor equilibrio entre trabajo y vida personal." },
    { "id": "v-gut-feeling", "word": "gut feeling", "translation": "corazonada, intuición", "partOfSpeech": "noun", "example": "I had a **gut feeling** that he wasn't telling the truth.", "exampleTranslation": "Tuve la corazonada de que no decía la verdad.", "pronunciationHint": "/ɡʌt/ · la u suena casi «a»" },
    { "id": "v-headline", "word": "headline", "translation": "ser cabeza de cartel", "partOfSpeech": "verb", "example": "The band will **headline** the festival this summer.", "exampleTranslation": "El grupo será cabeza de cartel del festival este verano." },
    { "id": "v-treasured", "word": "treasured possession", "translation": "posesión más preciada", "partOfSpeech": "phrase", "example": "This old watch is my most **treasured possession**.", "exampleTranslation": "Este reloj viejo es mi posesión más preciada.", "pronunciationHint": "/ˈtreʒəd pəˈzeʃn/" },
    { "id": "v-self-centred", "word": "self-centred", "translation": "egocéntrico", "partOfSpeech": "adjective", "example": "He's so **self-centred** that he never asks about you.", "exampleTranslation": "Es tan egocéntrico que nunca pregunta por ti." },
    { "id": "v-embarrassing", "word": "embarrassing", "translation": "embarazoso, que da vergüenza", "partOfSpeech": "adjective", "example": "Forgetting her name was really **embarrassing**.", "exampleTranslation": "Olvidarme de su nombre fue muy embarazoso.", "pronunciationHint": "/ɪmˈbærəsɪŋ/ · no significa «embarazada» (pregnant)" },
    { "id": "v-overuse", "word": "overuse", "translation": "abusar de, usar demasiado", "partOfSpeech": "verb", "example": "I **overuse** the word 'actually'.", "exampleTranslation": "Abuso de la palabra «actually».", "pronunciationHint": "/ˌəʊvəˈjuːz/ · verbo, con z final" },
    { "id": "v-owe", "word": "owe", "translation": "deber (dinero, un favor)", "partOfSpeech": "verb", "example": "I **owe** my sister twenty euros.", "exampleTranslation": "Le debo veinte euros a mi hermana.", "pronunciationHint": "/əʊ/ · suena como la letra «o» en inglés" },
    { "id": "v-wallpaper", "word": "wallpaper", "translation": "fondo de pantalla", "partOfSpeech": "noun", "example": "My **wallpaper** is a photo of my dog.", "exampleTranslation": "Mi fondo de pantalla es una foto de mi perro." },
    { "id": "v-keep-awake", "word": "keep somebody awake", "translation": "mantener despierto, quitar el sueño", "partOfSpeech": "phrase", "example": "The noise from the street **keeps me awake**.", "exampleTranslation": "El ruido de la calle no me deja dormir." },
    { "id": "v-fall-asleep", "word": "fall asleep", "translation": "quedarse dormido", "partOfSpeech": "verb", "example": "I always **fall asleep** on the train.", "exampleTranslation": "Siempre me quedo dormido en el tren." },
    { "id": "v-guilty-pleasure", "word": "guilty pleasure", "translation": "placer culpable", "partOfSpeech": "noun", "example": "Reality TV is my **guilty pleasure**.", "exampleTranslation": "Los realities son mi placer culpable.", "pronunciationHint": "/ˈɡɪlti ˈpleʒə/ · la u de guilty no suena" },
    { "id": "v-tough", "word": "tough", "translation": "difícil, duro", "partOfSpeech": "adjective", "example": "They asked me some really **tough** questions.", "exampleTranslation": "Me hicieron unas preguntas muy difíciles.", "pronunciationHint": "/tʌf/ · «taf»" },
    { "id": "v-weakness", "word": "weakness", "translation": "punto débil", "partOfSpeech": "noun", "example": "My biggest **weakness** is that I'm impatient.", "exampleTranslation": "Mi mayor punto débil es que soy impaciente." },
    { "id": "v-strength", "word": "strength", "translation": "punto fuerte", "partOfSpeech": "noun", "example": "Working in a team is one of her **strengths**.", "exampleTranslation": "Trabajar en equipo es uno de sus puntos fuertes.", "pronunciationHint": "/streŋθ/" },
    { "id": "v-selfish", "word": "selfish", "translation": "egoísta", "partOfSpeech": "adjective", "example": "It was **selfish** of him to eat all the cake.", "exampleTranslation": "Fue egoísta por su parte comerse toda la tarta." },
    { "id": "v-drive", "word": "drive", "translation": "empuje, ambición", "partOfSpeech": "noun", "example": "She has the **drive** to succeed in business.", "exampleTranslation": "Tiene el empuje necesario para triunfar en los negocios." },
    { "id": "v-apply-for", "word": "apply for a job", "translation": "solicitar un empleo", "partOfSpeech": "phrase", "example": "I've **applied for** three **jobs** this month.", "exampleTranslation": "He solicitado tres empleos este mes." }
  ],
  "phrases": [
    { "id": "p-prefer-not", "en": "I'd prefer not to answer that.", "es": "Preferiría no contestar a eso.", "context": "Para negarte con educación a responder una pregunta indiscreta." },
    { "id": "p-rather-not", "en": "I'd rather not answer that if you don't mind.", "es": "Preferiría no contestar a eso, si no te importa.", "context": "Igual que la anterior. Ojo: después de «would rather» va el verbo sin «to»." },
    { "id": "p-oh-really", "en": "Oh, really?", "es": "¿Ah, sí? / ¿De verdad?", "context": "Para mostrar interés por lo que te acaban de decir." },
    { "id": "p-what-a-shame", "en": "What a shame!", "es": "¡Qué pena!", "context": "Para mostrar compasión ante una mala noticia." },
    { "id": "p-me-too", "en": "Me too!", "es": "¡Yo también!", "context": "Para decir que te pasa lo mismo." },
    { "id": "p-how-interesting", "en": "How interesting!", "es": "¡Qué interesante!", "context": "Exclamación para mostrar interés." },
    { "id": "p-why-is-that", "en": "Why is that?", "es": "¿Y eso por qué?", "context": "Pregunta de seguimiento para que la otra persona siga hablando." },
    { "id": "p-why-say-that", "en": "Why do you say that?", "es": "¿Por qué lo dices?", "context": "Pregunta de seguimiento tras una opinión." },
    { "id": "p-could-you-tell-me", "en": "Could you tell me…?", "es": "¿Podría decirme…?", "context": "Introduce una pregunta indirecta, más educada." },
    { "id": "p-would-you-mind", "en": "Would you mind telling me…?", "es": "¿Le importaría decirme…?", "context": "Introduce una pregunta indirecta muy educada." },
    { "id": "p-any-idea", "en": "Do you have any idea…?", "es": "¿Tienes idea de…?", "context": "Introduce una pregunta indirecta." },
    { "id": "p-i-wonder", "en": "I wonder…", "es": "Me pregunto…", "context": "Va seguido del orden de una pregunta indirecta (sujeto + verbo)." }
  ],
  "grammar": [
    {
      "id": "g-inversion",
      "title": "Preguntas con auxiliar o modal",
      "explanation": "En inglés la pregunta se marca cambiando el orden: el auxiliar o el modal pasa delante del sujeto. Si el tiempo verbal no tiene auxiliar (presente y pasado simples), se añade **do / does / did**.",
      "rules": [
        "Con auxiliar (be, have…) o modal (should, can, must…): **auxiliar + sujeto + verbo**.",
        "En presente simple y pasado simple: **do / does / did + sujeto + infinitivo** sin «to».",
        "El orden completo es: (partícula interrogativa) + auxiliar + sujeto + verbo principal."
      ],
      "examples": [
        { "en": "How long **have you** lived here?", "es": "¿Cuánto tiempo llevas viviendo aquí?" },